{
  "schemaVersion": "1.0",
  "requestId": "cleanup-example",
  "contextDigest": "dddddddddddddddddddddddddddddddddddddddddddddddddddddddddddddddd",
  "policyDigest": "bbbbbbbbbbbbbbbbbbbbbbbbbbbbbbbbbbbbbbbbbbbbbbbbbbbbbbbbbbbbbbbb",
  "recoveryEpoch": 0,
  "observedAt": "2026-10-24T12:00:00Z",
  "eligible": false,
  "blockers": [
    "untracked_work"
  ],
  "evidenceRefs": [
    "inspection:example"
  ],
  "inspection": {
    "schemaVersion": "1.0",
    "requestId": "cleanup-example",
    "installationId": "example-installation",
    "targetId": "source",
    "workspaceId": "example-workspace",
    "creationOperationId": "example-create",
    "receiptDigest": "aaaaaaaaaaaaaaaaaaaaaaaaaaaaaaaaaaaaaaaaaaaaaaaaaaaaaaaaaaaaaaaa",
    "policyDigest": "bbbbbbbbbbbbbbbbbbbbbbbbbbbbbbbbbbbbbbbbbbbbbbbbbbbbbbbbbbbbbbbb",
    "observedAt": "2026-10-24T12:00:00Z",
    "blockers": [
      "untracked_work"
    ],
    "counts": {
      "tracked": 0,
      "untracked": 1,
      "ignored": 0,
      "unpushed": 0
    },
    "remoteRefsDigest": "cccccccccccccccccccccccccccccccccccccccccccccccccccccccccccccccc"
  },
  "observations": {
    "merge": null,
    "targets": [],
    "sessions": [],
    "managed": null,
    "keep": null
  }
}
